{
  "schema_version": 1,
  "schema_uri": "https://qedgen.dev/schemas/auditor-bench/score-v1.schema.json",
  "corpus_entry_ids": ["synthetic-escrow-smoke"],
  "tier_entry_counts": {
    "smoke": 1,
    "standard": 0,
    "hard": 0,
    "adversarial": 0
  },
  "per_difficulty": {
    "smoke": {
      "entry_count": 1,
      "ground_truth_count": 1,
      "reported_count": 1,
      "true_positives": 1,
      "recall": 1.0,
      "precision": 1.0
    }
  },
  "aggregate": {
    "entry_count": 1,
    "ground_truth_count": 1,
    "reported_count": 1,
    "true_positives": 1,
    "recall": 1.0,
    "precision": 1.0
  },
  "comparison": {
    "kind": "skill-regression",
    "baseline_tier_entry_counts": {
      "smoke": 1,
      "standard": 0,
      "hard": 0,
      "adversarial": 0
    },
    "candidate_tier_entry_counts": {
      "smoke": 1,
      "standard": 0,
      "hard": 0,
      "adversarial": 0
    },
    "composition_valid": true
  }
}
